name,research_field,topic
Taylor Reed,Software Engineering,Runtime Verification of Adaptive Microservice Architectures Under Distributed Failure Scenarios
Riley Jain,Robotics,Learning‑Based Resilient Coordination of Heterogeneous Robotic Swarms in Dynamic Environments
Taylor Adams,Computer Vision,Unsupervised Spatiotemporal Representation Learning Using Diffusion Models for Real‑Time Video Anomaly Detection
Devon Thomas,Machine Learning,Uncertainty‑Aware Reinforcement Learning for Automated Hyperparameter Optimization in Large‑Scale Distributed Machine Learning
Alex Lee,Computational Complexity,Fine‑Grained Complexity of Dynamic Subgraph Isomorphism in Sparse Graphs
Riley Rivera,Bioinformatics,Scalable Graph Neural Networks for Pan‑Genomic Variant Calling with Uncertainty Quantification
Alex Adams,Computational Complexity,Parameterized Complexity and Kernelization Limits for the Edge‑Disjoint Paths Problem in Directed Graphs
Skyler Thomas,Programming Languages,"Design, Implementation and Formal Verification of a Hybrid Static‑Dynamic Type System for Safe Interoperability Between Statically Typed and Dynamically Typed Programming Paradigms"
Charlie Gonzalez,Software Engineering,Reinforcement Learning‑Guided Automatic Generation of Resilient Cloud‑Native Microservice Architectures
Alex Chen,Database Systems,Adaptive Snapshot Isolation for Low‑Latency Transactions in Distributed Columnar Databases
Bailey Kumar,Robotics,Embodied Pragmatic Grounding for Natural Language Interaction with Collaborative Robots: A Multimodal Approach to Human-Robot Dialogue
Casey Liu,Natural Language Processing,Integrating Multimodal Knowledge Graphs with Few-Shot Meta-Learning for Contextualized Commonsense Reasoning in Low‑Resource Natural Language Processing
Morgan Clark,Natural Language Processing,Multimodal Explainable Summarization: Leveraging Contrastive Alignment of Text and Visual Context for Factually Grounded Narrative Generation
Cameron Davis,Bioinformatics,Hybrid Graph Neural Network Approach for Multi‑Omic Integration and Gene Regulatory Network Inference in Cancer Evolution
Jamie Smith,Cybersecurity,Design and Evaluation of an AI‑Assisted Threat Intelligence Platform Leveraging Graph Neural Networks for Real‑Time Attack Prediction
Skyler Garcia,Distributed Systems,Energy‑Aware Byzantine‑Resilient Consensus for Heterogeneous Edge‑to‑Fog Distributed Systems
Morgan Adams,Operating Systems,Designing a Machine‑Learning–Assisted Adaptive Scheduler for Real‑Time Cloud Operating Systems
Reese Davis,Quantum Computing,"Quantum‑Error‑Corrected Algorithms for Exponential Speedup in Practical Optimization Problems: Theory, Design, and Implementation on Fault‑Tolerant Architectures"
Casey Lee,Machine Learning,Adaptive Semi-Supervised Federated Learning with Privacy-Preserving Contrastive Representation Optimization
Riley Singh,Computer Vision,"Diffusion-Guided Multi-View Stereo for Robust, Real-Time 3D Reconstruction in Unstructured Outdoor Environments"
Riley Garcia,Distributed Systems,Designing Adaptive Consistency Models for Low‑Latency Blockchain‑Based Distributed Systems under Heterogeneous Network Conditions
Jamie Brooks,Computer Networks,Self‑Healing Software‑Defined Networks: A Deep Reinforcement Learning Framework for Real‑time Failure Detection and Automated Recovery in Heterogeneous Telecommunication Infrastructures
Sam Davis,Computer Networks,Adaptive Multicast Routing in Software‑Defined SD‑WANs Using Deep Reinforcement Learning
Casey Kumar,Computer Vision,Self‑Supervised Multi‑Modal Feature Fusion for Real‑Time Robust Autonomous Navigation in Adverse Weather Conditions
Reese Chen,Information Retrieval,Adaptive Conversational Retrieval via Hierarchical Transformer‑Based Contextual Semantics and Reinforcement‑Learning Fine‑Tuning for Real‑Time Document Ranking
Riley Chen,Cybersecurity,"Quantum‑Resilient, Differentially Private Federated Deep‑Learning for Real‑Time Intrusion Detection"
Sydney Kumar,Information Retrieval,Hybrid Graph‑Neural Architectures for Multi‑Modal Contextualized Information Retrieval with Explainable Decision Support
Riley Liu,Machine Learning,Adaptive Semi‑Supervised Learning on Dynamic Graphs via Spatio‑Temporal Self‑Attention Techniques for Explainable Recommendation Systems
Riley Smith,Computer Architecture,Adaptive Sparse Matrix-Multiply Acceleration on Programmable Quantum Dot Arrays for Energy‑Efficient Neural Network Inference
Sydney Kumar,Computer Vision,End-to-End Differentiable Rendering for Explainable 3D Shape Generation from Single Images using Diffusion Models
Casey Gonzalez,Computer Architecture,Energy‑Efficient On‑Die Neural Inference Engines via Volatile Memory Integration and Voltage‑Domain Partitioning
Casey Flores,Distributed Systems,Reinforcement Learning‑Driven Adaptive Consistency in Heterogeneous Edge–Cloud Distributed Systems
Charlie Patel,Software Engineering,Towards Self‑Repairing Continuous Delivery Systems Using Probabilistic Program Analysis and Reinforcement Learning
Avery Jain,Information Retrieval,Privacy‑Aware Federated Information Retrieval: Trustworthy Ranking under Differentially Private Constraints
Skyler Kumar,Quantum Computing,Designing Adaptive Quantum Error Mitigation Schemes for Hybrid Classical–Quantum Machine Learning Workflows
Robin Gonzalez,Distributed Systems,Latency‑Adaptative Consensus Protocols for Edge‑Distributed Databases
Cameron Jain,Robotics,Adaptive Decentralized Planning in Heterogeneous Robotic Swarms via Hierarchical Reinforcement Learning
Kris Flores,Computer Vision,Neuro‑Symbolic Graph‑Transformer Models for Explainable Visual Reasoning and Scene Understanding
Jordan Garcia,Robotics,Adaptive Multi‑Agent Cooperative Robot Swarms for Dynamic Search and Rescue Operations
Sam Thomas,Bioinformatics,Integrating Graph Neural Networks with Multi‑Omics Data to Predict Gene Regulatory Interactions in Cancer Subtypes
Morgan Clark,Distributed Systems,"Adaptive, Low-Latency Consensus Protocols for Heterogeneous Edge-Cloud Federated Systems"
Reese Brooks,Computer Graphics,Learning-based Real-time Physically Based Rendering with Integrated Denoising for Interactive Ray Tracing
Jamie Adams,Artificial Intelligence,Adaptive Federated Transfer Learning for Edge AI with Privacy‑Preserving Differential Guarantees
Taylor Adams,Software Engineering,"Predictive Fault Mitigation in Continuous Delivery Pipelines Through Explainable, Reinforcement‑Learning Enhancements of Deployment Orchestration"
Bailey Garcia,Operating Systems,Designing Energy‑Aware Real‑Time Scheduling Algorithms for Distributed Edge Operating Systems on Heterogeneous Hardware Platforms
Robin Chen,Cybersecurity,Quantum‑Resistant Authentication Protocols for Decentralized Web of Things Infrastructure
Alex Kumar,Computer Graphics,Real-Time Hybrid Physics–Neural Rendering for Immersive Virtual Environments
Sam Rivera,Natural Language Processing,Zero‑Shot Cross‑Lingual Named Entity Recognition Using Knowledge‑Enhanced Transformer Architectures
Dakota Rivera,Bioinformatics,Hybrid Graph Neural Networks and Explainable AI for Predicting Gene Regulatory Network Dynamics in Single‑Cell Transcriptomic Landscapes
Casey Patel,Computer Networks,Resilient Network Slicing Strategies Against Faults and Attacks in NFV-Based 5G Environments: A Machine Learning Approach to Adaptive Traffic Engineering
Sam Adams,Computer Graphics,Real‑Time Neural Radiance Field Reconstruction for Immersive Mixed‑Reality Environments
Alex Campbell,Computer Architecture,"Design and Evaluation of Energy-Aware, Heterogeneous Multi‑Processor Architectures for Low‑Power AI Inference"
Dana Reed,Natural Language Processing,Federated Learning for Privacy‑Preserving Natural Language Processing on Resource‑Constrained Edge Devices
Cameron Singh,Programming Languages,"Composing Effectful Computations: A Dependent-Typed, Algebraic-Effects Framework for Incremental and Safe Concurrent Programming"
Jordan Jain,Quantum Computing,Scalable Quantum Error Correction Codes Optimized for Fault‑Tolerant Surface Code Architectures
Morgan Lee,Human-Computer Interaction,Designing Emotionally Intelligent User Interfaces for Inclusive Collaborative Virtual Workspaces
Morgan Adams,Robotics,Hierarchical Bayesian Planning for Context-Aware Obstacle Avoidance in Legged Robotics
Avery Flores,Information Retrieval,"Dynamic Knowledge Graph-based Hybrid Retrieval: Balancing Efficiency, Explainability, and Fairness in Large-scale Document Search"
Sam Kumar,Computer Graphics,Perceptually Optimized Neural Radiance Fields for Low‑Bandwidth Real‑Time Virtual Reality Streaming
Reese Thomas,Computational Complexity,Investigating Fine-Grained Lower Bounds for Approximate Counting in Sparse Constraint Satisfaction Problems
Skyler O'Hara,Operating Systems,Formal Verification of Non‑Volatile Memory Ordering Guarantees in Next‑Generation Operating System Kernels
Sydney Davis,Cybersecurity,"Securing Next‑Generation IoT: Designing Adaptive, Privacy‑Preserving Intrusion Detection via Federated Deep Learning and Differential Privacy"
Kris Brooks,Natural Language Processing,Multimodal Retrieval-augmented Transformer Architectures for Cross‑Lingual Few‑Shot Natural Language Understanding
Riley Jain,Computer Vision,End-to-End Joint Learning of Neural Radiance Fields and 3D Scene Geometry for High-Resolution Drone-Based Surveillance
Bailey Reed,Quantum Computing,"Noise-Resilient Quantum Error Correction Codes for Near-Term Fault-Tolerant Architectures: Design, Analysis, and Implementation on NISQ Devices"
Skyler Jain,Quantum Computing,Efficient Quantum Error Mitigation Techniques for Near‑Term Noisy Intermediate‑Scale Quantum Devices Using Adaptive Tensor Networks
Riley Reed,Computer Vision,Self‑Supervised Multi‑View Depth Estimation with Diffusion‑Based Geometry Priors for Low‑Light and Unreliable Imaging Conditions
Jordan Jain,Computer Vision,Zero‑Shot Object Detection via Prompted Vision‑Language Models and Adaptive Knowledge Distillation for Large‑Scale Real‑World Scenarios
Jordan Liu,Computer Vision,Hierarchical Graph Neural Networks for Robust 3D Reconstruction from Sparse RGB‑Depth Streams in Dynamic Environments
Kris Jain,Software Engineering,"Human‑In‑The‑Loop AI for Real‑Time Bug Detection, Diagnosis, and Automated Repair in Large-Scale Software Systems"
Dana O'Hara,Information Retrieval,"Deep Reinforcement‑Learning Driven Adaptive Indexing for Federated, Privacy‑Preserving Information Retrieval Systems"
Avery Gonzalez,Quantum Computing,Hybrid Quantum–Classical Co-optimization for Resource-Efficient Variational Algorithms on Fault‑Tolerant Platforms
Dana Jain,Human-Computer Interaction,"Emotion‑Aware Adaptive Interfaces for Collaborative Immersive Virtual Environments: Design, Evaluation, and Impact on Team Cognition"
Robin O'Hara,Natural Language Processing,Cross‑Lingual Transferability of Multimodal Language Models for Zero‑Shot Sentiment Analysis in Low‑Resource Languages
Taylor Thomas,Computer Networks,Hybrid Quantum-Classical Routing Algorithms for Low-Latency 5G Millimeter-Wave Mesh Backhaul Networks
Robin Thomas,Cybersecurity,Adversarially Robust Federated Learning for Privacy‑Preserving Anomaly Detection in Industrial IoT Networks
Jordan Garcia,Machine Learning,Towards Robust Causality-Aware Federated Learning for Privacy-Preserving Edge Intelligence
Sydney Liu,Natural Language Processing,Towards Universal Prompt Engineering for Low‑Resource Languages via Cross‑Lingual Meta‑Learning and Adaptive Data Augmentation
Riley O'Hara,Computational Complexity,Fine‑Grained Complexity of Sparse Max‑Cut under the Strong Exponential Time Hypothesis
Skyler Brooks,Robotics,Hybrid Vision–LiDAR SLAM with Graph Neural Networks for Autonomous Drone Swarms in Dynamic Environments
Robin Chen,Software Engineering,Conflict‑Aware Automated Refactoring Chains for Evolutionary Maintenance in Large‑Scale Object‑Oriented Systems
Charlie Jain,Computer Vision,Self‑Supervised Multi‑Modal Fusion for Robust 3D Object Recognition in Adverse Weather Conditions
Charlie Adams,Natural Language Processing,Explainable Neural Commonsense Reasoning for Cross‑Lingual Question Answering Using Structured Knowledge Distillation
Jordan Adams,Artificial Intelligence,Adaptive Federated Learning for Privacy-Preserving Edge Intelligence in Smart IoT Networks
Morgan Jain,Algorithms and Data Structures,Cache‑Oblivious Parallel Data Structures for Scalable Graph Analytics on Multi‑Core Architectures
Robin Flores,Human-Computer Interaction,Designing Adaptive Multimodal Interfaces for Inclusive Digital Environments Through Context‑Aware Machine Learning
Casey Clark,Machine Learning,Causal Discovery in Large‑Scale Heterogeneous Graphs via Semi‑Supervised Contrastive Learning
Sam Clark,Artificial Intelligence,Scalable Federated Multi‑Modal Knowledge Graph Embedding for Privacy‑Preserving Intelligent Systems
Sydney Kumar,Cybersecurity,Zero‑Trust Orchestration of Decentralized IoT Devices Using Homomorphic Encryption and Federated Learning
Dakota Thomas,Information Retrieval,Neural Retrieval of Multi‑Modal Documents with Adaptive Contrastive Learning and Query Expansion
Dana Patel,Computational Complexity,Fine‑Grained Complexity and Time Lower Bounds for Counting Solutions to Boolean Constraint Satisfaction Problems with Bounded Variable Occurrence
Dakota O'Hara,Machine Learning,Integrative Multi‑Modal Representation Learning for Real‑Time Autonomous Driving in Unstructured Environments
Devon Adams,Machine Learning,Design and Analysis of Federated Multi‑Task Learning Algorithms with Provable Privacy and Generalization Guarantees for Resource‑Constrained Edge Environments
Bailey Smith,Machine Learning,Scalable Federated Learning with Differential Privacy Guarantees on Edge Devices
Devon Flores,Computer Graphics,Neural‑Enhanced Real‑Time Ray Tracing for Immersive Simulations
Kris Chen,Machine Learning,Integrating Causality and Contrastive Learning for Explainable AI in Dynamic Graphs
Kris Lee,Algorithms and Data Structures,Cache‑Aware Hierarchical Decomposition for Sublinear‑Time Dynamic Shortest Path Queries in Massive Graphs
Morgan Campbell,Computer Vision,Self‑Supervised Multi‑Modal Fusion Networks for Robust Zero‑Shot Action Recognition in Adverse Weather Conditions
Riley Clark,Natural Language Processing,Hybrid Symbolic–Neural Architectures for Context‑Aware Sentiment Analysis Across Multimodal Text Streams
Devon Jain,Quantum Computing,Designing Adaptive Machine‑Learning driven Error Mitigation Protocols for Noise‑Resilient Near‑Term Quantum Supremacy Experiments
Reese Smith,Bioinformatics,Graph-Based Deep Generative Modeling for Predicting Protein–Protein Interaction Interfaces in Human Immune Signaling Pathways
Morgan Thomas,Quantum Computing,Entanglement-Enhanced Quantum Error Correction for Near-Term Superconducting Architectures
Devon Rivera,Computer Architecture,Designing Energy‑Efficient Heterogeneous Multi‑Core Architectures for Real‑Time Edge AI Inference
Jamie O'Hara,Computer Architecture,"Co-Design of Photonic Interconnects and 3D-Integrated Logic for Ultra‑High Bandwidth, Low‑Latency Computation"
Riley Kumar,Distributed Systems,Machine-Learning Guided Adaptive Consistency Protocols for Heterogeneous Edge‑Cloud Federated Distributed Systems
Avery Singh,Cybersecurity,Quantum‑Resilient Federated Learning Frameworks for Secure Multi‑Party Collaboration across Heterogeneous Cloud Environments
Bailey Lee,Artificial Intelligence,Unifying Probabilistic Reasoning and Deep Representation Learning for Robust Few-Shot Generalization in Dynamic Autonomous Systems
Charlie Campbell,Quantum Computing,Hybrid Variational Algorithms for Decoherence-Resilient Quantum Machine Learning on Near-Term Devices
Taylor Lee,Information Retrieval,Self-supervised Continual Learning for Adaptive Document Retrieval in Dynamic Knowledge Bases
Casey Rivera,Software Engineering,"“Toward a Formal, Machine‑Learning–Assisted Framework for Runtime Verification of Self-Adaptive Microservice Architectures”"
Avery Davis,Computer Vision,"Neural Scene Graphs for Joint Object Detection, Tracking, and Interaction Reasoning in Realistic Indoor Environments"
Riley Davis,Operating Systems,Self-Adaptive Scheduling for Heterogeneous Multicore Real‑Time Systems
Sam Brooks,Information Retrieval,Contrastive Learning of Joint Text–Image Representations for Scalable Cross‑Modal Information Retrieval in Knowledge Graphs
Dakota Campbell,Computer Graphics,Real-time Neural Radiance Fields for Immersive Virtual Environments
Alex Adams,Operating Systems,Learning‑Based Dynamic Memory Allocation for Energy‑Efficient Embedded Operating Systems
Taylor Patel,Software Engineering,Graph Neural Network‑Enabled Detection and Automated Refactoring of Architectural Anti‑Patterns in Legacy Enterprise Software Systems
Taylor Garcia,Information Retrieval,Enhancing Contextualized Information Retrieval in Low‑Resource Languages through Contrastive Learning and Knowledge Graph Integration
Avery Kumar,Operating Systems,Self‑Adaptive Scheduling for Heterogeneous Real‑Time Operating Systems Using Reinforcement Learning
Reese O'Hara,Computer Architecture,Designing Adaptive Cache Hierarchies for Energy‑Efficient High‑Performance Computing Using Machine–Learning Driven Placement and Eviction Policies
Casey Kumar,Computer Graphics,Unified Differentiable Rendering for Real-Time Photorealistic Virtual Reality Applications
Dana Kumar,Machine Learning,Federated Learning with Adaptive Differential Privacy for Secure Healthcare Analytics
Morgan Thomas,Software Engineering,Hybrid Formal and Machine‑Learning Techniques for Runtime Verification of Adaptive Software Systems
Jordan Reed,Computer Architecture,Hybrid Non‑Volatile Memory Architectures for Low‑Power Edge AI Accelerators
Avery Kumar,Algorithms and Data Structures,Hybrid Succinct Indexing Schemes for Massive Graph Streams
Charlie Adams,Database Systems,"Scalable Graph Query Processing over Federated, Multi‑Cluster Distributed Databases"
Skyler Reed,Natural Language Processing,Zero-Shot Cross-Lingual Narrative Generation via Hierarchical Graph Neural Language Modeling
Morgan Patel,Information Retrieval,Federated Learning of Private Retrieval Models: Balancing Accuracy and Differential Privacy Across Heterogeneous Devices
Jordan Davis,Quantum Computing,Hybrid Variational Quantum‑Classical Algorithms for Efficient Solving of Large‑Scale Combinatorial Optimization Problems
Skyler Patel,Database Systems,Hybrid Approximation and Exact Query Execution for Real‑Time Analytics in Distributed Columnar Databases
Avery Smith,Operating Systems,"Adaptive, Self‑Optimizing I/O Scheduling in Cloud‑Based Virtualized Environments Using Reinforcement Learning"
Cameron Smith,Computer Networks,Adaptive Cross-Layer Optimization of 5G Ultra-Reliable Low‑Latency Communications Using Reinforcement Learning in Software‑Defined Networking Environments
Casey Jain,Natural Language Processing,Advancing Explainable Transfer Learning in Low‑Resource Multilingual Dialogue Systems through Structured Knowledge Integration
Cameron Adams,Database Systems,Learning-Driven Adaptive Index Selection for Cost-Efficient OLAP Queries in Cloud-Based Data Warehouses
Reese Patel,Programming Languages,Designing a Linear Type System for Concurrency Safety in Functional Programming
Sam Chen,Database Systems,Privacy‑Preserving Federated Query Processing over Heterogeneous Multi‑Cloud Databases
Alex Chen,Computer Architecture,Scalable Cache-Coherence Mechanisms for Nonvolatile Memory-Based Many‐Core Architectures
Robin Jain,Software Engineering,Automated Quality Assurance Governance for Microservices-Driven Software Ecosystems
Sam Garcia,Distributed Systems,Design and Analysis of Hybrid Consensus Protocols for Ultra‑Low Latency Geo‑Distributed Networks
Jordan Flores,Programming Languages,Formal Foundations and Implementation Strategies for Incremental Type Inference in Large‑Scale Statically Typed Domain‑Specific Languages
Casey Brooks,Computer Networks,"Hierarchical Software‑Defined Control for Scalable, Secure Service Function Chaining in Multi‑Domain NFV Networks"
Dakota Jain,Programming Languages,"Composable Effect Systems for Concurrent Functional Programming: Syntax, Semantics, and Verification"
Alex O'Hara,Distributed Systems,Towards Energy‑Aware Fault‑Tolerant Consistency in Decentralized IoT Mesh Networks
Bailey Kumar,Computer Vision,Deep Self‑Supervised Alignment of Cross‑Domain Visual Representations for Robust Zero‑Shot Object Detection in Dynamic Environments
Jamie Davis,Computer Graphics,Real‑Time Neural Rendering of Complex Scenes Using Diffusion‑Driven Radiance Fields on Heterogeneous Architectures
Sydney Adams,Computer Architecture,Energy‑Efficient 3D‑Integrated Cache Hierarchies for Edge AI Accelerators
Alex Garcia,Software Engineering,Hybrid Formal‑Statistical Runtime Verification of Serverless Microservice Architectures for Early Failure Detection and Self-Healing
Sam Gonzalez,Software Engineering,Adaptive AI-Driven Test Prioritization in Continuous Integration Pipelines for Complex Microservice Architectures
Jordan Garcia,Bioinformatics,Integrative Graph Neural Networks for Multi‑Omics Disease Subtyping and Biomarker Discovery
Robin Davis,Computer Architecture,Adaptive Memory Hierarchy Design for Low‑Power AI Workloads Using Near‑Data Processing
Robin Campbell,Computer Graphics,Hybrid Neural–Physical Modeling for Real‑Time Photorealistic Rendering in Interactive Virtual Environments
Taylor Clark,Quantum Computing,Adaptive Variational Quantum Algorithms with Resource‑Aware Circuit Compression for Noise‑Resilient NISQ Devices
Casey Kumar,Machine Learning,Self‑Supervised Discovery of Causal Structures in Large‑Scale Time‑Series Data Using Graph Neural Networks
Robin Reed,Computer Graphics,"Dynamic, Real-Time Ray-Tracing for Large-Scale Virtual Environments Using Adaptive Volumetric Neural Radiance Fields and GPU-Accelerated Hierarchical Scene Partitioning"
Skyler O'Hara,Computer Networks,Optimizing Multi‑Layer Software‑Defined Networking for Low‑Latency Edge IoT Systems: A Machine Learning‑Driven Approach to Adaptive Path Selection and Resource Allocation
Robin Lee,Computer Architecture,Adaptive Energy‑Aware Cache Hierarchies for Heterogeneous Deep Learning Accelerators
Reese Liu,Natural Language Processing,Symbolic‑Augmented Neural Architectures for Explainable Multi‑Task Few‑Shot Language Understanding
Dakota Rivera,Operating Systems,"Energy‑Proportional Data‑Center Operating Systems via Predictive, Fine‑Grained Power Management and Adaptive Scheduling"
Robin Liu,Distributed Systems,Hybrid Sharding and State Machine Replication for Ultra‑Low Latency in Cross‑Cloud Federated Systems
Dakota Adams,Robotics,Hybrid Deep Reinforcement Learning with Model Predictive Control for Real‑Time Obstacle Avoidance in Autonomous Mobile Robots
Casey Thomas,Distributed Systems,Decentralized Consensus Protocols with Adaptive Latency Guarantees for Multi‑Cloud Edge Computing
Sam Campbell,Quantum Computing,Hybrid Quantum-Classical Optimization for Large-Scale NP-Hard Problems on NISQ Devices
Dakota Clark,Information Retrieval,**Federated Knowledge Distillation for Privacy‑Preserving Cross‑Device Information Retrieval**
Alex Singh,Operating Systems,"Designing Adaptive, Energy-Aware Real‑Time Scheduling Algorithms for Heterogeneous Multi‑Core Operating Systems"
Casey Thomas,Quantum Computing,Design and Evaluation of Adaptive Hybrid Quantum-Classical Algorithms for Solving Large-Scale Combinatorial Optimization Problems on NISQ Hardware
Reese Liu,Cybersecurity,An Explainable Graph Neural Network Framework for Real‑Time Anomaly Detection and Attribution in Industrial Control Systems
Charlie Brooks,Computational Complexity,Fine‑Grained Reductions and Kernelization Lower Bounds for Subgraph Isomorphism in Minor‑Free Graphs
Kris Flores,Algorithms and Data Structures,Hybrid External‑Memory and Succinct Data Structures for Ultra‑Large‑Scale Graph Analytics
Morgan Singh,Computer Graphics,Real‑Time Neural Radiance Field Rendering via Adaptive Sampling and Edge‑Aware Temporal Filtering for Immersive Virtual Environments
Reese Liu,Computer Vision,Hybrid Diffusion-Graph Neural Networks for Unsupervised 3D Scene Reconstruction from Sparse Multi‑View Video Streams
Riley Singh,Programming Languages,Composable Formal Semantics for Concurrent Functional Programming Languages with Weak Memory Models
Casey Patel,Artificial Intelligence,Designing Adaptive Multi‑Agent Reinforcement Learning Systems for Decentralized Autonomous Control Under Resource Constraints
Jordan Jain,Human-Computer Interaction,Multimodal Interaction Strategies for Enhancing User Understanding of Explainable Machine Learning Models in High‑Stake Environments
Reese Lee,Cybersecurity,Adaptive Zero‑Trust Architectures Leveraging Federated Machine Learning for Real‑Time Threat Detection in Multi‑Cloud Environments
Robin Gonzalez,Computational Complexity,Fine-Grained Complexity of Sparse Graph Isomorphism via Matrix Multiplication Reductions
Sydney Flores,Distributed Systems,Toward Energy‑Efficient Byzantine Consensus for Heterogeneous Edge–Cloud Federations
Riley Patel,Artificial Intelligence,Hybrid Symbolic‑Neural Architectures for Interpretable Autonomous Planning in Dynamic Environments
Taylor Thomas,Programming Languages,A Dependent Type System for Safe Concurrent Programming via Linear Logic Integration
